id,label,timeset,py,so,modularity_class,clustering,triangles,degree
1496,Pricing computer services under alternative control structures: Tradeoffs and trends,,1996,INFORMATION SYSTEMS RESEARCH,3,0.48484848484848486,32,12
1497,On data representation and use in a temporal relational DBMS,,1996,INFORMATION SYSTEMS RESEARCH,6,0.775,93,16
1498,Inductive model analysis systems: Enhancing model analysis in decision support systems,,1996,INFORMATION SYSTEMS RESEARCH,18,0.2953846153846154,96,26
1499,The use and effects of knowledge-based system explanations: Theoretical foundations and a framework for empirical evaluation,,1996,INFORMATION SYSTEMS RESEARCH,14,0.6666666666666666,24,9
1500,Providing design assistance: A case-based approach,,1996,INFORMATION SYSTEMS RESEARCH,24,0.3088235294117647,42,17
1501,The effect of codes of ethics and personal denial of responsibility on computer abuse judgments and intentions,,1996,MIS QUARTERLY,13,0.6363636363636364,35,11
1502,Sustainable collaboration: Managing conflict and cooperation in interorganizational systems,,1996,MIS QUARTERLY,12,0.35555555555555557,16,10
1503,Expert systems usage: Task change and intrinsic motivation,,1996,MIS QUARTERLY,24,0.2878787878787879,19,12
1504,Measuring the extent of EDI usage in complex organizations: Strategies and illustrative examples,,1996,MIS QUARTERLY,3,1.0,45,10
1505,Teledemocracy: Using information technology to enhance political work,,1996,MIS QUARTERLY,6,1.0,55,11
1506,Sustaining process improvement and innovation in the information services function: Lessons learned at the Bose Corporation,,1996,MIS QUARTERLY,23,0.2692307692307692,21,13
1507,Are attributes entities? A study of database designers' memory structures,,1996,INFORMATION SYSTEMS RESEARCH,16,0.47435897435897434,37,13
1508,Alternative securities trading systems: Tests and regulatory implications of the adoption of technology,,1996,INFORMATION SYSTEMS RESEARCH,8,0.8596491228070176,147,19
1509,A computational study of distributed rule learning,,1996,INFORMATION SYSTEMS RESEARCH,19,0.5194805194805194,120,22
1510,Information acquisition and mental models: An investigation into the relationship between behaviour and learning,,1996,INFORMATION SYSTEMS RESEARCH,19,0.22727272727272727,15,12
1511,A theory of decision support system design for user calibration,,1996,INFORMATION SYSTEMS RESEARCH,18,0.7142857142857143,65,14
1512,Overcoming ineffective mental representations in base-rate problems,,1996,INFORMATION SYSTEMS RESEARCH,18,0.2982456140350877,51,19
1513,"Top management support, external expertise and information systems implementation in small businesses",,1996,INFORMATION SYSTEMS RESEARCH,11,0.0,0,5
1514,Process structuring in electronic brainstorming,,1996,INFORMATION SYSTEMS RESEARCH,15,0.5555555555555556,85,18
1515,"Productivity, business profitability, and consumer surplus: Three different measures of information technology value",,1996,MIS QUARTERLY,1,0.45714285714285713,96,21
1516,Relational development in computer-supported groups,,1996,MIS QUARTERLY,15,0.5732574679943101,403,38
1517,Information privacy: Measuring individuals' concerns about organizational practices,,1996,MIS QUARTERLY,5,0.9311594202898551,257,24
1518,Information technology for local administration support: The governorates project in Egypt,,1996,MIS QUARTERLY,11,0.7114624505928854,180,23
1519,Key issues in information systems management: 1994-95 SIM delphi results,,1996,MIS QUARTERLY,7,0.22529644268774704,57,23
1520,"The role of IT in the transformation of work: A comparison of post-industrial, industrial, and proto-industrial organization",,1996,INFORMATION SYSTEMS RESEARCH,24,0.3333333333333333,35,15
1521,"Information technology and organizational change in the British census, 1801-1911",,1996,INFORMATION SYSTEMS RESEARCH,24,0.2857142857142857,8,8
1522,Texas polities and the fax revolution,,1996,INFORMATION SYSTEMS RESEARCH,24,0.14285714285714285,3,7
1523,Information technology in the police context: The ''sailor'' phone,,1996,INFORMATION SYSTEMS RESEARCH,24,0.22727272727272727,120,33
1524,Improvising organizational transformation over time: A situated change perspective,,1996,INFORMATION SYSTEMS RESEARCH,24,0.24630541871921183,100,29
1525,Transforming work through information technology: A comparative case study of geographic information systems in county government,,1996,INFORMATION SYSTEMS RESEARCH,24,0.18,54,25
1526,Steps toward an ecology of infrastructure: Design and access for large information spaces,,1996,INFORMATION SYSTEMS RESEARCH,23,0.42424242424242425,28,12
1527,Issues and concerns about computer-supported meetings: The facilitator's perspective,,1996,MIS QUARTERLY,15,0.9215686274509803,141,18
1528,Determinants of commitment to information systems development: A longitudinal investigation,,1996,MIS QUARTERLY,11,0.6988636363636364,369,33
1529,Measuring the linkage between business and information technology objectives,,1996,MIS QUARTERLY,7,0.3333333333333333,35,15
1530,An empirical examination of the value of creativity support systems on idea generation,,1996,MIS QUARTERLY,15,0.8727272727272727,48,11
1531,Reconciling variance and process strategies for studying information system development,,1995,INFORMATION SYSTEMS RESEARCH,17,0.14285714285714285,3,7
1532,Improving the performance stability of inductive expert systems under input noise,,1995,INFORMATION SYSTEMS RESEARCH,3,0.26143790849673204,40,18
1533,Using treemaps to visualize the Analytic Hierarchy Process,,1995,INFORMATION SYSTEMS RESEARCH,24,0.2222222222222222,8,9
1534,The emergence of interpretivism in IS research,,1995,INFORMATION SYSTEMS RESEARCH,24,0.33689839572192515,189,34
1535,Pulling the plug: Software project management and the problem of project escalation,,1995,MIS QUARTERLY,11,0.6166666666666667,481,40
1536,Added value and pricing with information technology,,1995,MIS QUARTERLY,8,0.6379310344827587,259,29
1537,Electronic data interchange and small organizations: Adoption and impact of technology,,1995,MIS QUARTERLY,3,0.8484848484848485,56,12
1538,Information technology and sustained competitive advantage: A resource-based analysis,,1995,MIS QUARTERLY,23,0.48333333333333334,58,16
1539,Information systems design decisions in a global versus domestic context,,1995,MIS QUARTERLY,11,0.6833333333333333,82,16
1540,The impact of computer alienation on information technology investment decisions: An exploratory cross-national analysis,,1995,MIS QUARTERLY,19,0.23809523809523808,5,7
1541,THE EFFECT OF COORDINATION AND UNCERTAINTY ON SOFTWARE PROJECT PERFORMANCE - RESIDUAL PERFORMANCE RISK AS AN INTERVENING VARIABLE,,1995,INFORMATION SYSTEMS RESEARCH,11,0.39766081871345027,68,19
1542,MODELING COORDINATION IN SOFTWARE CONSTRUCTION - AN ANALYTICAL APPROACH,,1995,INFORMATION SYSTEMS RESEARCH,4,0.49002849002849,172,27
1543,MODELING TEAM PROCESSES - ISSUES AND A SPECIFIC EXAMPLE,,1995,INFORMATION SYSTEMS RESEARCH,4,0.6936572199730094,514,39
1544,THE RELEVANCE OF APPLICATION DOMAIN KNOWLEDGE - THE CASE OF COMPUTER-PROGRAM COMPREHENSION,,1995,INFORMATION SYSTEMS RESEARCH,16,0.3333333333333333,2,4
1545,THE USE OF INFORMATION TECHNOLOGY TO ENHANCE MANAGEMENT SCHOOL EDUCATION - A THEORETICAL VIEW,,1995,MIS QUARTERLY,19,0.48333333333333334,145,25
1546,USING IT TO REENGINEER BUSINESS EDUCATION - AN EXPLORATORY INVESTIGATION OF COLLABORATIVE TELELEARNING,,1995,MIS QUARTERLY,19,0.4426877470355731,112,23
1547,CRITICAL SKILLS AND KNOWLEDGE REQUIREMENTS OF IS PROFESSIONALS - A JOINT ACADEMIC-INDUSTRY INVESTIGATION,,1995,MIS QUARTERLY,10,0.3790849673202614,58,18
1548,IS95 - GUIDELINE FOR UNDERGRADUATE IS CURRICULUM,,1995,MIS QUARTERLY,23,1.0,1,2
1549,THE INFORMATION TECHNOLOGY INTERACTION-MODEL - A FOUNDATION FOR THE MBA CORE COURSE,,1995,MIS QUARTERLY,18,0.16363636363636364,9,11
1550,INSIDE AN INTEGRATED MBA - AN INFORMATION-SYSTEMS VIEW,,1995,MIS QUARTERLY,24,0.23076923076923078,18,13
1551,ACTUALIZING ORGANIZATIONAL MEMORY WITH INFORMATION-SYSTEMS,,1995,INFORMATION SYSTEMS RESEARCH,24,0.2222222222222222,38,19
1552,APPLICATION OF SOCIAL COGNITIVE THEORY TO TRAINING FOR COMPUTER SKILLS,,1995,INFORMATION SYSTEMS RESEARCH,19,0.5789473684210527,110,20
1553,UNDERSTANDING INFORMATION TECHNOLOGY USAGE - A TEST OF COMPETING MODELS,,1995,INFORMATION SYSTEMS RESEARCH,17,0.2875816993464052,44,18
1554,A CONFIRMATORY FACTOR-ANALYSIS OF THE USER INFORMATION SATISFACTION INSTRUMENT,,1995,INFORMATION SYSTEMS RESEARCH,21,0.4804804804804805,320,37
1555,BUSINESS VALUE OF INFORMATION TECHNOLOGY - A STUDY OF ELECTRONIC DATA INTERCHANGE,,1995,MIS QUARTERLY,3,0.9090909090909091,50,11
1556,THE IMPACT OF EXPLANATION FACILITIES ON USER ACCEPTANCE OF EXPERT-SYSTEMS ADVICE,,1995,MIS QUARTERLY,14,0.4,22,11
1557,SERVICE QUALITY - A MEASURE OF INFORMATION-SYSTEMS EFFECTIVENESS,,1995,MIS QUARTERLY,21,0.5797101449275363,160,24
1558,COMPUTER SELF-EFFICACY - DEVELOPMENT OF A MEASURE AND INITIAL TEST,,1995,MIS QUARTERLY,19,0.46320346320346323,107,22
1559,TASK-TECHNOLOGY FIT AND INDIVIDUAL-PERFORMANCE,,1995,MIS QUARTERLY,18,0.12727272727272726,7,11
1560,INFORMATION TECHNOLOGIES AND BUSINESS VALUE - AN ANALYTIC AND EMPIRICAL-INVESTIGATION,,1995,INFORMATION SYSTEMS RESEARCH,24,0.2909090909090909,16,11
1561,CONTROLLING INFORMATION-SYSTEM DEPARTMENTS IN THE PRESENCE OF COST INFORMATION ASYMMETRY,,1995,INFORMATION SYSTEMS RESEARCH,3,0.16666666666666666,6,9
1562,DESIGNING INFORMATION-SYSTEMS TO OPTIMIZE THE ACCURACY-TIMELINESS TRADEOFF,,1995,INFORMATION SYSTEMS RESEARCH,18,0.38095238095238093,8,7
1563,THE IMPORTANCE OF SPECIFICATION IN CAUSAL-MODELING - THE CASE OF END-USER COMPUTING SATISFACTION,,1995,INFORMATION SYSTEMS RESEARCH,21,0.5176470588235295,308,35
1564,THE EVOLUTION OF IS JOB SKILLS - A CONTENT-ANALYSIS OF IS JOB ADVERTISEMENTS FROM 1970 TO 1990,,1995,MIS QUARTERLY,10,0.2867647058823529,39,17
1565,ELECTRONIC DOCUMENT MANAGEMENT - CHALLENGES AND OPPORTUNITIES FOR INFORMATION-SYSTEMS MANAGERS,,1995,MIS QUARTERLY,6,1.0,55,11
1566,EARLY EXPERT-SYSTEMS - WHERE ARE THEY NOW,,1995,MIS QUARTERLY,24,0.4,22,11
1567,EXPLORING THE FACTORS ASSOCIATED WITH EXPERT-SYSTEMS SUCCESS,,1995,MIS QUARTERLY,24,0.25757575757575757,17,12
1568,THE IMPACT OF JOB-PERFORMANCE EVALUATIONS ON CAREER ADVANCEMENT PROSPECTS - AN EXAMINATION OF GENDER DIFFERENCES IN THE IS WORKPLACE,,1995,MIS QUARTERLY,10,0.7230769230769231,235,26
1569,THE CONTRADICTORY STRUCTURE OF SYSTEMS-DEVELOPMENT METHODOLOGIES - DECONSTRUCTING THE IS-USER RELATIONSHIP IN INFORMATION ENGINEERING,,1994,INFORMATION SYSTEMS RESEARCH,24,0.40350877192982454,69,19
1570,IMPROVING END-USER PROFICIENCY - EFFECTS OF CONCEPTUAL TRAINING AND NATURE OF INTERACTION,,1994,INFORMATION SYSTEMS RESEARCH,19,0.47435897435897434,37,13
1571,"WHATS MINE IS OURS, OR IS IT - A STUDY OF ATTITUDES ABOUT INFORMATION SHARING",,1994,INFORMATION SYSTEMS RESEARCH,17,0.4222222222222222,19,10
1572,"USER PARTICIPATION, CONFLICT, AND CONFLICT-RESOLUTION - THE MEDIATING ROLES OF INFLUENCE",,1994,INFORMATION SYSTEMS RESEARCH,17,0.6944444444444444,25,9
1573,MODELING INTERPERSONAL PROCESSES DURING SYSTEM-DEVELOPMENT - FURTHER THOUGHTS AND SUGGESTIONS,,1994,INFORMATION SYSTEMS RESEARCH,17,0.3333333333333333,15,10
1574,COMPETING THROUGH EDI AT BRUN-PASSOT - ACHIEVEMENTS IN FRANCE AND AMBITIONS FOR THE SINGLE EUROPEAN MARKET,,1994,MIS QUARTERLY,20,0.42483660130718953,65,18
1575,PERCEPTIONS OF THE BENEFITS FROM THE INTRODUCTION OF CASE - AN EMPIRICAL-STUDY,,1994,MIS QUARTERLY,25,0.4358974358974359,34,13
1576,ALIGNMENT OF THE IS FUNCTIONS WITH THE ENTERPRISE - TOWARD A MODEL OF ANTECEDENTS,,1994,MIS QUARTERLY,24,0.15714285714285714,33,21
1577,CONCEPTUAL VERSUS PROCEDURAL SOFTWARE TRAINING FOR GRAPHICAL USER INTERFACES - A LONGITUDINAL-FIELD EXPERIMENT,,1994,MIS QUARTERLY,19,0.5847953216374269,100,19
1578,THE RELATIONSHIP BETWEEN USER PARTICIPATION AND USER SATISFACTION - AN INVESTIGATION OF 4 CONTINGENCY FACTORS,,1994,MIS QUARTERLY,17,0.39215686274509803,60,18
1579,MODEL INTEGRATION USING METAGRAPHS,,1994,INFORMATION SYSTEMS RESEARCH,18,0.7948717948717948,62,13
1580,ROLE OF CONTROL IN THE MODEL FORMULATION PROCESS,,1994,INFORMATION SYSTEMS RESEARCH,11,0.7362637362637363,67,14
1581,FORMAL MODELING OF COMPLEX COMMANDS IN INDUSTRIAL SOFTWARE SPECIFICATIONS,,1994,INFORMATION SYSTEMS RESEARCH,24,0.11428571428571428,12,15
1582,BENCHMARKING DECISION-MODELS FOR DATABASE - MANAGEMENT-SYSTEMS,,1994,INFORMATION SYSTEMS RESEARCH,6,0.45057471264367815,196,30
1583,"CLAIMS, ARGUMENTS, AND DECISIONS - FORMALISMS FOR REPRESENTATION, GAMING, AND COORDINATION",,1994,INFORMATION SYSTEMS RESEARCH,15,0.35714285714285715,75,21
1584,ADAPTATION OF A PLANNING SYSTEM SUCCESS MODEL TO INFORMATION-SYSTEMS PLANNING,,1994,INFORMATION SYSTEMS RESEARCH,7,0.42857142857142855,39,14
1585,CREATING AND SUSTAINING OF GLOBAL COMMUNITY OF SCHOLARS,,1994,MIS QUARTERLY,23,0.5333333333333333,64,16
1586,BUSINESS REENGINEERING AT CIGNA-CORPORATION - EXPERIENCES AND LESSONS LEARNED FROM THE 1ST 5 YEARS,,1994,MIS QUARTERLY,23,0.8545454545454545,47,11
1587,COMPUTERIZED LOAN ORIGINATION SYSTEMS - AN INDUSTRY CASE-STUDY OF THE ELECTRONIC MARKETS HYPOTHESIS,,1994,MIS QUARTERLY,8,0.6951566951566952,244,27
1588,AN EXPLORATORY-STUDY OF ROLES IN COMPUTER-SUPPORTED GROUPS,,1994,MIS QUARTERLY,15,0.6633333333333333,199,25
1589,THE INFLUENCE OF IT MANAGEMENT PRACTICE ON IT USE IN LARGE ORGANIZATIONS,,1994,MIS QUARTERLY,16,0.7780938833570412,547,38
1590,ORGANIZATIONAL CHARACTERISTICS AND INFORMATION-SYSTEMS PLANNING - AN EMPIRICAL-STUDY,,1994,INFORMATION SYSTEMS RESEARCH,7,0.48484848484848486,32,12
1591,COMPUTER-MEDIATED COMMUNICATION FOR INTELLECTUAL TEAMWORK - AN EXPERIMENT IN GROUP WRITING,,1994,INFORMATION SYSTEMS RESEARCH,15,0.4188034188034188,147,27
1592,INSTITUTIONAL FACTORS IN INFORMATION TECHNOLOGY INNOVATION,,1994,INFORMATION SYSTEMS RESEARCH,26,0.7842105263157895,149,20
1593,PRINCIPLES FOR EXAMINING PREDICTIVE-VALIDITY - THE CASE OF INFORMATION-SYSTEMS SPENDING FORECASTS,,1994,INFORMATION SYSTEMS RESEARCH,21,0.14285714285714285,4,8
1594,MODELING VS FORECASTING - THE CASE OF INFORMATION-SYSTEMS SPENDING,,1994,INFORMATION SYSTEMS RESEARCH,21,0.0,0,3
1595,REENGINEERING - BUSINESS CHANGE OF MYTHIC PROPORTIONS,,1994,MIS QUARTERLY,23,0.8545454545454545,47,11
1596,GENDER DIFFERENCES IN THE INFORMATION-SYSTEMS MANAGERIAL RANKS - AN ASSESSMENT OF POTENTIAL DISCRIMINATORY PRACTICES,,1994,MIS QUARTERLY,10,0.8571428571428571,78,14
1597,ELECTRONIC MAIL AS A MEDIUM FOR RICH COMMUNICATION - AN EMPIRICAL-INVESTIGATION USING HERMENEUTIC INTERPRETATION,,1994,MIS QUARTERLY,15,0.4147727272727273,219,33
1598,COMPUTER-MEDIATED COLLABORATIVE LEARNING - AN EMPIRICAL-EVALUATION,,1994,MIS QUARTERLY,19,0.4963768115942029,137,24
1599,"WORK EXPERIENCES, JOB INVOLVEMENT, AND QUALITY OF WORK LIFE AMONG INFORMATION-SYSTEMS PERSONNEL",,1994,MIS QUARTERLY,10,0.698005698005698,245,27
1600,FREE-ACCESS POLICY FOR INTERNAL NETWORKS,,1994,INFORMATION SYSTEMS RESEARCH,0,0.6727272727272727,37,11
1601,THE EFFECT OF CULTURE ON IT DIFFUSION - E-MAIL AND FAX IN JAPAN AND THE UNITED-STATES,,1994,INFORMATION SYSTEMS RESEARCH,14,0.6797385620915033,104,18
1602,USER RESPONSE DATA - THE POTENTIAL FOR ERRORS AND BIASES,,1994,INFORMATION SYSTEMS RESEARCH,13,0.06666666666666667,1,6
1603,THE FRENCH VIDEOTEX SYSTEM MINITEL - A SUCCESSFUL IMPLEMENTATION OF A NATIONAL INFORMATION TECHNOLOGY INFRASTRUCTURE,,1994,MIS QUARTERLY,23,0.0,0,1
1604,A MULTIMEDIA SOLUTION TO PRODUCTIVITY GRIDLOCK - A RE-ENGINEERED JEWELRY APPRAISAL SYSTEM AT ZALE-CORPORATION,,1994,MIS QUARTERLY,19,0.0,0,4
1605,STRATEGIC INFORMATION-SYSTEMS REVISITED - A STUDY IN SUSTAINABILITY AND PERFORMANCE,,1994,MIS QUARTERLY,23,0.4269005847953216,73,19
1606,"MEASURING USER PARTICIPATION, USER INVOLVEMENT, AND USER ATTITUDE",,1994,MIS QUARTERLY,17,0.27384615384615385,89,26
1607,REALIZING EMANCIPATORY PRINCIPLES IN INFORMATION-SYSTEMS DEVELOPMENT - THE CASE FOR ETHICS,,1994,MIS QUARTERLY,24,0.45,135,25
1608,(UN)STRUCTURED CREATIVITY IN INFORMATION-SYSTEMS ORGANIZATIONS,,1993,MIS QUARTERLY,15,0.9111111111111111,41,10
1609,DISTRIBUTED GROUP SUPPORT SYSTEMS,,1993,MIS QUARTERLY,15,0.4013605442176871,472,49
1610,TAILORING DATABASE TRAINING FOR END-USERS,,1993,MIS QUARTERLY,6,0.6928104575163399,106,18
1611,USER-DATABASE INTERFACE - THE EFFECT OF ABSTRACTION LEVELS ON QUERY PERFORMANCE,,1993,MIS QUARTERLY,6,0.5296442687747036,134,23
1612,IMPACT OF COMMUNICATION MEDIUM AND COMPUTER SUPPORT ON GROUP PERCEPTIONS AND PERFORMANCE - A COMPARISON OF FACE-TO-FACE AND DISPERSED MEETINGS,,1993,MIS QUARTERLY,15,0.2777777777777778,10,9
1613,THE EFFECTS OF INFORMATION-SYSTEM USER EXPECTATIONS ON THEIR PERFORMANCE AND PERCEPTIONS,,1993,MIS QUARTERLY,17,0.4264705882352941,58,17
1614,ASSESSING THE VALUE OF CONOCOS EIS,,1993,MIS QUARTERLY,3,0.3523809523809524,37,15
1615,DETERMINING INFORMATION REQUIREMENTS FOR AN EIS,,1993,MIS QUARTERLY,24,0.4666666666666667,21,10
1616,THE IMPACT OF INFORMATION TECHNOLOGY ON MIDDLE MANAGERS,,1993,MIS QUARTERLY,18,0.5714285714285714,16,8
1617,THE IS EXPECTATION GAP - INDUSTRY EXPECTATIONS VERSUS ACADEMIC PREPARATION,,1993,MIS QUARTERLY,10,0.4678362573099415,80,19
1618,CASE TOOLS AS ORGANIZATIONAL-CHANGE - INVESTIGATING INCREMENTAL AND RADICAL CHANGES IN SYSTEMS-DEVELOPMENT,,1993,MIS QUARTERLY,24,0.2217741935483871,110,32
1619,HOW DID THEY GET MY NAME - AN EXPLORATORY INVESTIGATION OF CONSUMER ATTITUDES TOWARD SECONDARY INFORMATION USE,,1993,MIS QUARTERLY,5,0.6267806267806267,220,27
1620,THE USEFULNESS OF COMPUTER-BASED INFORMATION TO PUBLIC MANAGERS,,1993,MIS QUARTERLY,7,0.27472527472527475,25,14
1621,METAPHORS AND METHODOLOGIES - LIVING BEYOND THE SYSTEMS MACHINE,,1993,MIS QUARTERLY,24,0.40711462450592883,103,23
1622,EXPLORING MODES OF FACILITATIVE SUPPORT FOR GDSS TECHNOLOGY,,1993,MIS QUARTERLY,15,0.6060606060606061,320,33
1623,EXPLORING INDIVIDUAL USER SATISFACTION WITHIN USER-LED DEVELOPMENT,,1993,MIS QUARTERLY,17,0.21367521367521367,75,27
1624,EXPERIENCES IN STRATEGIC INFORMATION-SYSTEMS PLANNING,,1993,MIS QUARTERLY,7,0.24175824175824176,22,14
1625,KNOWLEDGE-BASED APPROACHES TO DATABASE DESIGN,,1993,MIS QUARTERLY,6,0.3862433862433862,146,28
1626,SMALL-FIRM COMPUTING - MOTIVATORS AND INHIBITORS,,1993,MIS QUARTERLY,10,0.4,6,6
1627,TRAINING END USERS - AN EXPERIMENTAL INVESTIGATION OF THE ROLES OF THE COMPUTER-INTERFACE AND TRAINING METHODS,,1993,MIS QUARTERLY,19,0.49407114624505927,125,23
1628,COGNITIVE FEEDBACK IN GDSS - IMPROVING CONTROL AND CONVERGENCE,,1993,MIS QUARTERLY,15,0.48739495798319327,290,35
1629,ETHICAL STANDARDS FOR INFORMATION-SYSTEMS PROFESSIONALS - A CASE FOR A UNIFIED CODE,,1992,MIS QUARTERLY,13,0.7111111111111111,32,10
1630,UNDERSTANDING THE CEO CIO RELATIONSHIP,,1992,MIS QUARTERLY,7,0.7111111111111111,32,10
1631,EXECUTIVE OR FUNCTIONAL MANAGER - THE NATURE OF THE CIOS JOB,,1992,MIS QUARTERLY,7,0.5606060606060606,37,12
1632,NEW INFORMATION-SYSTEMS LEADERS - A CHANGING-ROLE IN A CHANGING WORLD,,1992,MIS QUARTERLY,7,0.3464052287581699,53,18
1633,EMPOWERMENT - KEY TO IS WORLD-CLASS QUALITY,,1992,MIS QUARTERLY,20,0.6071428571428571,17,8
1634,ORGANIZATIONAL EXPERIENCES AND CAREER SUCCESS OF MIS PROFESSIONALS AND MANAGERS - AN EXAMINATION OF RACE DIFFERENCES,,1992,MIS QUARTERLY,10,0.6206896551724138,252,29
1635,TOWARD A BETTER UNDERSTANDING OF INFORMATION TECHNOLOGY ORGANIZATION - A COMPARATIVE CASE-STUDY,,1992,MIS QUARTERLY,24,0.341991341991342,79,22
1636,THE PRISM SYSTEM - A KEY TO ORGANIZATIONAL-EFFECTIVENESS AT FEDERAL EXPRESS CORPORATION,,1992,MIS QUARTERLY,24,0.4,18,10
1637,THE IMPACT OF DATA INTEGRATION ON THE COSTS AND BENEFITS OF INFORMATION-SYSTEMS,,1992,MIS QUARTERLY,4,0.12727272727272726,7,11
1638,THE APPLICATION OF ELECTRONIC MEETING TECHNOLOGY TO SUPPORT STRATEGIC MANAGEMENT,,1992,MIS QUARTERLY,15,0.7333333333333333,77,15
1639,THE USE OF DECISION CRITERIA IN SELECTING INFORMATION-SYSTEMS TECHNOLOGY INVESTMENTS,,1992,MIS QUARTERLY,23,0.5777777777777777,26,10
1640,THE INFLUENCE OF THE INFORMATION-SYSTEMS DEVELOPMENT APPROACH ON MAINTENANCE,,1992,MIS QUARTERLY,24,0.49122807017543857,84,19
1641,THE USE OF INFORMATION IN DECISION-MAKING - AN EXPERIMENTAL INVESTIGATION OF THE IMPACT OF COMPUTER-BASED DECISION AIDS,,1992,MIS QUARTERLY,18,0.44666666666666666,134,25
1642,FACTORS AFFECTING SOFTWARE DEVELOPERS PERFORMANCE - AN INTEGRATED APPROACH,,1992,MIS QUARTERLY,25,0.8333333333333334,30,9
1643,EXAMINING THE FEASIBILITY OF A CASE-BASED REASONING MODEL FOR SOFTWARE EFFORT ESTIMATION,,1992,MIS QUARTERLY,21,0.46153846153846156,36,13
1644,"THREATS TO INFORMATION-SYSTEMS - TODAYS REALITY, YESTERDAYS UNDERSTANDING",,1992,MIS QUARTERLY,12,0.7023172905525846,394,34
1645,MANAGING TELECOMMUNICATIONS BY STEERING COMMITTEE,,1992,MIS QUARTERLY,7,0.3939393939393939,26,12
1646,MICROCOMPUTER PLAYFULNESS - DEVELOPMENT OF A MEASURE WITH WORKPLACE IMPLICATIONS,,1992,MIS QUARTERLY,19,0.4052631578947368,77,20
1647,"PERCEIVED USEFULNESS, EASE OF USE, AND USAGE OF INFORMATION TECHNOLOGY - A REPLICATION",,1992,MIS QUARTERLY,17,0.5911330049261084,240,29
1648,A SOCIAL-PROCESS MODEL OF USER-ANALYST RELATIONSHIPS,,1992,MIS QUARTERLY,11,0.5928030303030303,313,33
1649,STRATEGIC DATA PLANNING - LESSONS FROM THE FIELD,,1992,MIS QUARTERLY,7,0.36363636363636365,20,11
1650,THE ORGANIZATIONAL INTERFACE - A METHOD FOR SUPPORTING END USERS OF PACKAGED SOFTWARE,,1992,MIS QUARTERLY,19,0.3333333333333333,2,4
1651,PROBLEMS AND ISSUES IN THE MANAGEMENT OF INTERNATIONAL DATA COMMUNICATIONS NETWORKS - THE EXPERIENCES OF AMERICAN COMPANIES,,1992,MIS QUARTERLY,0,0.5584677419354839,277,32
1652,ON GENERALIZING THE CONCEPT OF HYPERTEXT,,1992,MIS QUARTERLY,3,0.8,84,15
1653,REVISITING DSS IMPLEMENTATION RESEARCH - A METAANALYSIS OF THE LITERATURE AND SUGGESTIONS FOR RESEARCHERS,,1992,MIS QUARTERLY,18,0.43956043956043955,40,14
1654,A SYNTHESIS OF RESEARCH ON REQUIREMENTS ANALYSIS AND KNOWLEDGE ACQUISITION TECHNIQUES,,1992,MIS QUARTERLY,21,0.32967032967032966,30,14
1655,INFORMATION ARCHITECTURE - IN SEARCH OF EFFICIENT FLEXIBILITY,,1991,MIS QUARTERLY,24,0.16363636363636364,9,11
1656,ACADEMIC ISSUES IN MIS - JOURNALS AND BOOKS,,1991,MIS QUARTERLY,24,0.5800865800865801,134,22
1657,AN APPLIED FRAMEWORK FOR CLASSIFYING THE COMPLEXITY OF KNOWLEDGE-BASED SYSTEMS,,1991,MIS QUARTERLY,24,0.43636363636363634,24,11
1658,INFORMATION-SYSTEMS MANAGEMENT ISSUES FOR THE 1990S,,1991,MIS QUARTERLY,7,0.17857142857142858,5,8
1659,EDUCATIONAL-NEEDS AS PERCEIVED BY IS AND END-USER PERSONNEL - A SURVEY OF KNOWLEDGE AND SKILL REQUIREMENTS,,1991,MIS QUARTERLY,10,0.3611111111111111,13,9
1660,UNDERSTANDING HUMAN-COMPUTER INTERACTION FOR INFORMATION-SYSTEMS DESIGN,,1991,MIS QUARTERLY,24,0.23076923076923078,18,13
1661,USAA-IBM PARTNERSHIPS IN INFORMATION TECHNOLOGY - MANAGING THE IMAGE PROJECT,,1991,MIS QUARTERLY,11,0.0,0,2
1662,THE APPLICATION SOFTWARE FACTORY - APPLYING TOTAL QUALITY TECHNIQUES TO SYSTEMS-DEVELOPMENT,,1991,MIS QUARTERLY,13,0.6666666666666666,14,7
1663,CAREER ORIENTATIONS OF MIS EMPLOYEES - AN EMPIRICAL-ANALYSIS,,1991,MIS QUARTERLY,10,0.6866096866096866,241,27
1664,KEY INFORMATION-SYSTEMS MANAGEMENT ISSUES FOR THE PUBLIC-SECTOR,,1991,MIS QUARTERLY,22,0.5105263157894737,97,20
1665,IS OFFICE PRODUCTIVITY STAGNANT,,1991,MIS QUARTERLY,7,0.0,0,3
1666,EXECUTIVE INVOLVEMENT AND PARTICIPATION IN THE MANAGEMENT OF INFORMATION TECHNOLOGY,,1991,MIS QUARTERLY,7,0.33986928104575165,52,18
1667,A MODEL OF USERS PERSPECTIVE ON CHANGE - THE CASE OF INFORMATION-SYSTEMS TECHNOLOGY IMPLEMENTATION,,1991,MIS QUARTERLY,24,0.4230769230769231,33,13
1668,A MODEL FOR MEASURING INFORMATION-SYSTEM SIZE,,1991,MIS QUARTERLY,13,0.21794871794871795,17,13
1669,EXECUTIVE INFORMATION-SYSTEMS - A FRAMEWORK FOR DEVELOPMENT AND A SURVEY OF CURRENT PRACTICES,,1991,MIS QUARTERLY,7,0.43636363636363634,24,11
1670,APPLICATIONS OF GLOBAL INFORMATION TECHNOLOGY - KEY ISSUES FOR MANAGEMENT,,1991,MIS QUARTERLY,7,0.10714285714285714,3,8
1671,EXECUTIVE INFORMATION REQUIREMENTS - GETTING IT RIGHT,,1991,MIS QUARTERLY,7,0.4727272727272727,26,11
1672,ON INFORMATION-SYSTEMS PROJECT ABANDONMENT - AN EXPLORATORY-STUDY OF ORGANIZATIONAL PRACTICES,,1991,MIS QUARTERLY,11,0.5703211517165006,515,43
1673,IDENTIFICATION OF STRATEGIC INFORMATION-SYSTEMS OPPORTUNITIES - APPLYING AND COMPARING 2 METHODOLOGIES,,1991,MIS QUARTERLY,24,0.44285714285714284,93,21
1674,DECISIONAL GUIDANCE FOR COMPUTER-BASED DECISION SUPPORT,,1991,MIS QUARTERLY,18,0.580952380952381,61,15
1675,PERSONAL COMPUTING - TOWARD A CONCEPTUAL-MODEL OF UTILIZATION,,1991,MIS QUARTERLY,19,0.7272727272727273,48,12
1676,Information Technology and Corporate Strategy: A View from the Top,,1990,INFORMATION SYSTEMS RESEARCH,1,0.4,6,6
1677,Electronic Integration and Strategic Advantage: A Quasi-Experimental Study in the Insurance Industry,,1990,INFORMATION SYSTEMS RESEARCH,8,0.0,0,1
1678,A Study of Collaborative Group Work With and Without Computer-Based Support,,1990,INFORMATION SYSTEMS RESEARCH,15,0.6524064171122995,366,34
1679,An Attribute Space for Organizational Communication Channels,,1990,INFORMATION SYSTEMS RESEARCH,15,0.4066666666666667,122,25
1680,TELCOT - AN APPLICATION OF INFORMATION TECHNOLOGY FOR COMPETITIVE ADVANTAGE IN THE COTTON INDUSTRY,,1990,MIS QUARTERLY,8,0.6666666666666666,10,6
1681,THE MARRIAGE OF RETAIL MARKETING AND INFORMATION-SYSTEMS TECHNOLOGY - THE ZELLERS CLUB-Z EXPERIENCE,,1990,MIS QUARTERLY,11,0.7051282051282052,55,13
1682,IMPLEMENTING ELECTRONIC MEETING SYSTEMS AT IBM - LESSONS LEARNED AND SUCCESS FACTORS,,1990,MIS QUARTERLY,4,0.4444444444444444,16,9
1683,A PRINCIPLES-BASED ENTERPRISE ARCHITECTURE - LESSONS FROM TEXACO AND STAR ENTERPRISE,,1990,MIS QUARTERLY,1,0.6666666666666666,10,6
1684,A NETWORK INFRASTRUCTURE TO CONTAIN COSTS AND ENABLE FAST RESPONSE - THE TRW PROCESS,,1990,MIS QUARTERLY,0,0.46984126984126984,296,36
1685,REUSABILITY-BASED STRATEGY FOR DEVELOPMENT OF INFORMATION-SYSTEMS - IMPLEMENTATION EXPERIENCE OF A BANK,,1990,MIS QUARTERLY,0,0.6666666666666666,10,6
1686,EIS - IT CAN WORK IN THE PUBLIC-SECTOR,,1990,MIS QUARTERLY,22,0.4642857142857143,13,8
