id,label,timeset,py,so,modularity_class,clustering,triangles,degree
994,Design principles for competence management systems: A synthesis of an action research study,,2004,MIS QUARTERLY,16,0.16666666666666666,1,4
995,Small business growth and internal transparency: The role of information systems,,2004,MIS QUARTERLY,11,0.49707602339181284,85,19
996,Dialogical action research at omega corporation,,2004,MIS QUARTERLY,24,0.30833333333333335,37,16
997,"IT Outsourcing strategies: Universalistic, contingency, and configurational explanations of success",,2004,INFORMATION SYSTEMS RESEARCH,22,0.8263157894736842,157,20
998,Real options and IT platform adoption: Implications for theory and practice,,2004,INFORMATION SYSTEMS RESEARCH,12,0.6373626373626373,58,14
999,An empirical analysis of network externalities in peer-to-peer music-sharing networks,,2004,INFORMATION SYSTEMS RESEARCH,0,0.3842746400885936,347,43
1000,Impact of environmental uncertainty and task characteristics on user satisfaction with data,,2004,INFORMATION SYSTEMS RESEARCH,17,0.5833333333333334,21,9
1001,Information overload and the message dynamics of online interaction spaces: A theoretical model and empirical exploration,,2004,INFORMATION SYSTEMS RESEARCH,15,0.5142857142857142,54,15
1002,Information technology payoff in e-business environments: An international perspective on value creation of e-business in the financial services industry,,2004,JOURNAL OF MANAGEMENT INFORMATION SYSTEMS,23,0.2878787878787879,19,12
1003,Reexamining the value relevance of e-commerce initiatives,,2004,JOURNAL OF MANAGEMENT INFORMATION SYSTEMS,23,0.3333333333333333,5,6
1004,Measuring firm performance at the network level: A nomology of the business impact of digital supply networks,,2004,JOURNAL OF MANAGEMENT INFORMATION SYSTEMS,23,0.39285714285714285,11,8
1005,Understanding determinants of online consumer satisfaction: A decision process perspective,,2004,JOURNAL OF MANAGEMENT INFORMATION SYSTEMS,8,0.7948717948717948,62,13
1006,Proprietary and open systems adoption in e-procurement: A risk-augmented transaction cost perspective,,2004,JOURNAL OF MANAGEMENT INFORMATION SYSTEMS,3,0.6111111111111112,22,9
1007,The complementarity of information technology infrastructure and e-commerce capability: A resource-based assessment of their business value,,2004,JOURNAL OF MANAGEMENT INFORMATION SYSTEMS,23,0.46842105263157896,89,20
1008,Stopping behavior of systems analysts during information requirements elicitation,,2004,JOURNAL OF MANAGEMENT INFORMATION SYSTEMS,21,0.7619047619047619,16,7
1009,The meaning and measurement of user satisfaction: A multigroup invariance analysis of the end-user computing satisfaction instrument,,2004,JOURNAL OF MANAGEMENT INFORMATION SYSTEMS,21,0.6410256410256411,225,27
1010,What makes an ERP implementation relationship worthwhile: Linking trust mechanisms and ERP usefulness,,2004,JOURNAL OF MANAGEMENT INFORMATION SYSTEMS,14,0.4757834757834758,167,27
1011,"Operationalizing the essential role of the information technology artifact in information systems research: Gray area, pitfalls, and the importance of strategic ambiguity",,2004,MIS QUARTERLY,24,0.6666666666666666,4,4
1012,GIST: A model for design and management of content and interactivity of customer-centric Web sites,,2004,MIS QUARTERLY,14,0.5816091954022988,253,30
1013,A field study of the effect of interpersonal trust on virtual collaborative relationship performance,,2004,MIS QUARTERLY,14,0.7211948790896159,507,38
1014,Understanding changes in belief and attitude toward information technology usage: A theoretical model and longitudinal test,,2004,MIS QUARTERLY,17,0.4095238095238095,86,21
1015,"The effect of relationship encoding, task type, and complexity on information representation: An empirical evaluation of 2D and 3D line graphs",,2004,MIS QUARTERLY,18,0.3516483516483517,32,14
1016,Review: Information technology and organizational performance: An integrative model of IT business value,,2004,MIS QUARTERLY,23,0.14102564102564102,11,13
1017,A fault threshold policy to manage software development projects,,2004,INFORMATION SYSTEMS RESEARCH,4,0.0,0,1
1018,Economics of an information intermediary with aggregation benefits,,2004,INFORMATION SYSTEMS RESEARCH,20,0.42857142857142855,255,35
1019,Building effective online marketplaces with institution-based trust,,2004,INFORMATION SYSTEMS RESEARCH,8,0.3977272727272727,210,33
1020,Does animation attract online users' attention? The effects of flash on information search performance and perceptions,,2004,INFORMATION SYSTEMS RESEARCH,1,0.47058823529411764,64,17
1021,A practice perspective on technology-mediated network relations: The use of Internet-based self-serve technologies,,2004,INFORMATION SYSTEMS RESEARCH,20,0.30833333333333335,37,16
1022,Integrating collaborative processes and quality assurance techniques: Experiences from requirements negotiation,,2004,JOURNAL OF MANAGEMENT INFORMATION SYSTEMS,9,0.5151515151515151,34,12
1023,Foundation for the study of computer-supported collaborative learning requiring immersive presence,,2004,JOURNAL OF MANAGEMENT INFORMATION SYSTEMS,19,0.5108695652173914,141,24
1024,A unified model of requirements elicitation,,2004,JOURNAL OF MANAGEMENT INFORMATION SYSTEMS,21,0.6111111111111112,22,9
1025,Collaborative business engineering: A decade of lessons from the field,,2004,JOURNAL OF MANAGEMENT INFORMATION SYSTEMS,23,0.8545454545454545,47,11
1026,"Interpersonal traits, complementarity, and trust in virtual collaboration",,2004,JOURNAL OF MANAGEMENT INFORMATION SYSTEMS,14,0.8298850574712644,361,30
1027,A comparison of classification methods for predicting deception in computer-mediated communication,,2004,JOURNAL OF MANAGEMENT INFORMATION SYSTEMS,3,0.2727272727272727,15,11
1028,Causal relationships in creative problem solving: Comparing facilitation interventions for ideation,,2004,JOURNAL OF MANAGEMENT INFORMATION SYSTEMS,15,0.8727272727272727,48,11
1029,Supporting collaboration in heterogeneous environments,,2004,JOURNAL OF MANAGEMENT INFORMATION SYSTEMS,4,0.5384615384615384,42,13
1030,Beta versus VHS and the acceptance of electronic brainstorming technology,,2004,MIS QUARTERLY,15,0.6176470588235294,84,17
1031,User heterogeneity and its impact on electronic auction market design: An empirical exploration,,2004,MIS QUARTERLY,2,0.9076923076923077,295,26
1032,How do suppliers benefit from information technology use in supply chain relationships?,,2004,MIS QUARTERLY,8,0.673202614379085,103,18
1033,Design science in Information Systems research,,2004,MIS QUARTERLY,24,0.3476190476190476,73,21
1034,"Review: The resource-based view and information systems research: Review, extension, and suggestions for future research",,2004,MIS QUARTERLY,24,0.4095238095238095,86,21
1035,The influence of business managers' IT competence on championing IT,,2003,INFORMATION SYSTEMS RESEARCH,16,0.7507246376811594,777,46
1036,Synthesis and decomposition of processes in organizations,,2003,INFORMATION SYSTEMS RESEARCH,24,0.25,30,16
1037,A research note regarding the development of the consensus on appropriation scale,,2003,INFORMATION SYSTEMS RESEARCH,21,0.6551724137931034,285,30
1038,Knowing-why about data processes and data quality,,2003,JOURNAL OF MANAGEMENT INFORMATION SYSTEMS,16,0.8896551724137931,387,30
1039,The design and implementation of a corporate householding knowledge processor to improve data quality,,2003,JOURNAL OF MANAGEMENT INFORMATION SYSTEMS,16,0.6466666666666666,194,25
1040,Time-related factors of data quality in multichannel information systems,,2003,JOURNAL OF MANAGEMENT INFORMATION SYSTEMS,8,0.7205882352941176,98,17
1041,Crafting rules: Context-reflective data quality problem solving,,2003,JOURNAL OF MANAGEMENT INFORMATION SYSTEMS,25,0.4444444444444444,16,9
1042,Information technology investments and firms' performance - A duopoly perspective,,2003,JOURNAL OF MANAGEMENT INFORMATION SYSTEMS,23,0.3103448275862069,126,29
1043,The matrix of control: Combining process and structure approaches to managing software development,,2003,JOURNAL OF MANAGEMENT INFORMATION SYSTEMS,11,0.6282051282051282,49,13
1044,The role of system trust in business-to-consumer transactions,,2003,JOURNAL OF MANAGEMENT INFORMATION SYSTEMS,14,0.7932773109243697,472,35
1045,An inductively derived model of leader-initiated relationship building with virtual team members,,2003,JOURNAL OF MANAGEMENT INFORMATION SYSTEMS,4,0.4958371877890842,536,47
1046,A longitudinal field study of training practices in a collaborative application environment,,2003,JOURNAL OF MANAGEMENT INFORMATION SYSTEMS,19,0.41106719367588934,104,23
1047,Dealing with plagiarism in the information systems research community: A look at factors that drive plagiarism and ways to address them,,2003,MIS QUARTERLY,24,0.6549707602339181,112,19
1048,The contingent effects of management support and task interdependence on successful information systems implementation,,2003,MIS QUARTERLY,7,0.43333333333333335,52,16
1049,The disruptive nature of information technology innovations: The case of Internet computing in systems development organizations,,2003,MIS QUARTERLY,26,0.5876923076923077,191,26
1050,"Rigor in information systems positivist case research: Current practices, trends, and recommendations",,2003,MIS QUARTERLY,24,0.2658536585365854,218,41
1051,The value relevance of announcements of transformational information technology investments,,2003,MIS QUARTERLY,23,0.33992094861660077,86,23
1052,Sources of influence on beliefs about information technology use: An empirical study of knowledge workers,,2003,MIS QUARTERLY,17,0.4473684210526316,85,20
1053,Generalizing generalizability in information systems research,,2003,INFORMATION SYSTEMS RESEARCH,24,0.25,9,9
1054,Replicating online Yankee auctions to analyze auctioneers' and bidders' strategies,,2003,INFORMATION SYSTEMS RESEARCH,2,0.9076923076923077,295,26
1055,Improving analysis pattern reuse in conceptual design: Augmenting automated processes with supervised learning,,2003,INFORMATION SYSTEMS RESEARCH,24,0.2833333333333333,34,16
1056,Portfolios of control in outsourced software development projects,,2003,INFORMATION SYSTEMS RESEARCH,11,0.5789473684210527,110,20
1057,Justifying contingent information technology investments: Balancing the need for speed of action with certainty before action,,2003,JOURNAL OF MANAGEMENT INFORMATION SYSTEMS,12,0.43722943722943725,101,22
1058,What do you know? Rational expectations in information technology adoption and investment,,2003,JOURNAL OF MANAGEMENT INFORMATION SYSTEMS,0,0.32727272727272727,18,11
1059,"Codifiability, relationship-specific information technology investment, and optimal contracting",,2003,JOURNAL OF MANAGEMENT INFORMATION SYSTEMS,8,0.48484848484848486,32,12
1060,Consumers prefer bundled add-ins,,2003,JOURNAL OF MANAGEMENT INFORMATION SYSTEMS,25,0.2989247311827957,139,31
1061,Contingency pricing for information goods and services under industrywide performance standard,,2003,JOURNAL OF MANAGEMENT INFORMATION SYSTEMS,8,0.5095238095238095,321,36
1062,Economic implications of variable technology standards for movie piracy in a global context,,2003,JOURNAL OF MANAGEMENT INFORMATION SYSTEMS,13,0.7941176470588235,108,17
1063,A taxonomy of antecedents of information systems success: Variable analysis studies,,2003,JOURNAL OF MANAGEMENT INFORMATION SYSTEMS,7,0.28095238095238095,59,21
1064,From the vendor's perspective: Exploring the value proposition in information technology outsourcing,,2003,MIS QUARTERLY,22,0.28024193548387094,139,32
1065,Trust and the unintended effects of behavior control in virtual teams,,2003,MIS QUARTERLY,4,0.7042042042042042,469,37
1066,The influence of query interface design on decision-making performance,,2003,MIS QUARTERLY,18,0.45454545454545453,25,11
1067,User acceptance of information technology: Toward a unified view,,2003,MIS QUARTERLY,17,0.3888888888888889,147,28
1068,In pursuit of moderation: Nine common errors and their solutions,,2003,MIS QUARTERLY,18,0.5384615384615384,49,14
1069,Measuring information technology payoff: A meta-analysis of structural variables in firm-level empirical research,,2003,INFORMATION SYSTEMS RESEARCH,23,0.25,30,16
1070,Developing and validating an observational learning model of computer software training and skill acquisition,,2003,INFORMATION SYSTEMS RESEARCH,19,0.4523076923076923,147,26
1071,The impact of experience and time on the use of Data Quality Information in decision making,,2003,INFORMATION SYSTEMS RESEARCH,18,0.4025974025974026,93,22
1072,A partial least squares latent variable modeling approach for measuring interaction effects: Results from a Monte Carlo simulation study and an electronic-mail emotion/adoption study,,2003,INFORMATION SYSTEMS RESEARCH,21,0.40615384615384614,132,26
1073,Organizing visions for information technology and the information systems executive response,,2003,JOURNAL OF MANAGEMENT INFORMATION SYSTEMS,7,0.4444444444444444,16,9
1074,Extending critical success factors methodology to facilitate broadly participative information systems planning,,2003,JOURNAL OF MANAGEMENT INFORMATION SYSTEMS,15,0.4,6,6
1075,Nearing the threshold: An economics approach to pressure on information systems professionals to separate from their employer,,2003,JOURNAL OF MANAGEMENT INFORMATION SYSTEMS,10,1.0,1,2
1076,Investigating determinants of software developers' intentions to follow methodologies,,2003,JOURNAL OF MANAGEMENT INFORMATION SYSTEMS,24,0.5163398692810458,79,18
1077,Software piracy in the workplace: A model and empirical test,,2003,JOURNAL OF MANAGEMENT INFORMATION SYSTEMS,13,0.6078431372549019,93,18
1078,"Knowledge management enablers, processes, and organizational performance: An integrative view and empirical examination",,2003,JOURNAL OF MANAGEMENT INFORMATION SYSTEMS,16,0.6154882154882155,914,55
1079,Product-based workflow design,,2003,JOURNAL OF MANAGEMENT INFORMATION SYSTEMS,24,0.4444444444444444,20,10
1080,Exploring the core concepts of media richness theory: The impact of cue multiplicity and feedback immediacy on decision quality,,2003,JOURNAL OF MANAGEMENT INFORMATION SYSTEMS,15,0.6125356125356125,215,27
1081,Identification of comment authorship in anonymous group support systems,,2003,JOURNAL OF MANAGEMENT INFORMATION SYSTEMS,15,0.64,208,26
1082,The identity crisis within the is discipline: Defining and communicating the discipline's core properties,,2003,MIS QUARTERLY,24,0.32105263157894737,61,20
1083,Reconceptualizing users as social actors in information systems research,,2003,MIS QUARTERLY,0,0.21637426900584794,37,19
1084,Shaping agility through digital options: Reconceptualizing the role of information technology in contemporary firms,,2003,MIS QUARTERLY,23,0.3810483870967742,189,32
1085,"Virtualness and knowledge in teams: Managing the love triangle of organizations, individuals, and information technology",,2003,MIS QUARTERLY,4,0.4629014396456257,418,43
1086,The adoption and use of GSS in project teams: Toward more participative processes and outcomes,,2003,MIS QUARTERLY,4,0.5669988925802879,512,43
1087,Decentralized mechanism design for supply chain organizations using an auction market,,2003,INFORMATION SYSTEMS RESEARCH,18,0.13333333333333333,2,6
1088,XML-based schema definition for support of interorganizational workflow,,2003,INFORMATION SYSTEMS RESEARCH,24,0.5555555555555556,25,10
1089,Informational influence in organizations: An integrated approach to knowledge adoption,,2003,INFORMATION SYSTEMS RESEARCH,0,0.3793103448275862,165,30
1090,When subordinates become IT contractors: Persistent managerial expectations in IT outsourcing,,2003,INFORMATION SYSTEMS RESEARCH,22,0.8362573099415205,143,19
1091,The social construction of meaning: An alternative perspective on information sharing,,2003,INFORMATION SYSTEMS RESEARCH,15,0.4523076923076923,147,26
1092,Information goods pricing and copyright enforcement: Welfare analysis,,2003,INFORMATION SYSTEMS RESEARCH,13,1.0,10,5
1093,The DeLone and McLean model of information systems success: a ten-year update,,2003,JOURNAL OF MANAGEMENT INFORMATION SYSTEMS,7,0.6545454545454545,36,11
1094,Collaboration engineering with ThinkLets to pursue sustained success with group support systems,,2003,JOURNAL OF MANAGEMENT INFORMATION SYSTEMS,15,0.6783625730994152,116,19
1095,Toward an understanding of satisfaction with the process and outcomes of teamwork,,2003,JOURNAL OF MANAGEMENT INFORMATION SYSTEMS,15,0.6092307692307692,198,26
1096,Modeling and simulation for mission operations work system design,,2003,JOURNAL OF MANAGEMENT INFORMATION SYSTEMS,24,0.27450980392156865,42,18
1097,Because time matters: Temporal coordination in global virtual project teams,,2003,JOURNAL OF MANAGEMENT INFORMATION SYSTEMS,4,0.5057471264367817,220,30
1098,Team boundary issues across multiple global firms,,2003,JOURNAL OF MANAGEMENT INFORMATION SYSTEMS,4,0.8068965517241379,351,30
1099,Generating and browsing multiple taxonomies over a document collection,,2003,JOURNAL OF MANAGEMENT INFORMATION SYSTEMS,6,0.8717948717948718,68,13
1100,A methodology for analyzing web-based qualitative data,,2003,JOURNAL OF MANAGEMENT INFORMATION SYSTEMS,24,0.39,117,25
1101,Relating collaborative technology use to teamwork quality and performance: An empirical analysis,,2003,JOURNAL OF MANAGEMENT INFORMATION SYSTEMS,4,0.4123076923076923,134,26
1102,Information systems as a reference discipline for new product development,,2003,MIS QUARTERLY,24,0.43,129,25
1103,Predicting intention to adopt interorganizational linkages: An institutional perspective,,2003,MIS QUARTERLY,0,0.4380952380952381,46,15
1104,Trust and TAM in online shopping: An integrated model,,2003,MIS QUARTERLY,14,0.4924506387921022,424,42
1105,Understanding the service component of application service provision: An empirical analysis of satisfaction with ASP services,,2003,MIS QUARTERLY,17,0.34065934065934067,31,14
1106,Issues in linking information technology capability to firm performance,,2003,MIS QUARTERLY,23,0.29743589743589743,232,40
1107,CIO lateral influence behaviors: Gaining peers' commitment to strategic information systems,,2003,MIS QUARTERLY,7,0.8333333333333334,30,9
1108,Research commentary: Information systems and conceptual modeling - A research agenda,,2002,INFORMATION SYSTEMS RESEARCH,24,0.2727272727272727,18,12
1109,Research commentary: The next wave of Nomadic computing,,2002,INFORMATION SYSTEMS RESEARCH,24,0.2,3,6
1110,The security of confidential numerical data in databases,,2002,INFORMATION SYSTEMS RESEARCH,12,0.5492424242424242,290,33
1111,A comparative study of distributed learning environments on learning outcomes,,2002,INFORMATION SYSTEMS RESEARCH,19,0.5476190476190477,115,21
1112,"Potential research space in MIS: A framework for envisioning and evaluating research replication, extension, and generation",,2002,INFORMATION SYSTEMS RESEARCH,16,0.3742690058479532,64,19
1113,Research report: Intrafirm resource allocation with asymmetric information and negative externalities,,2002,INFORMATION SYSTEMS RESEARCH,3,0.26666666666666666,4,6
1114,Newly vulnerable markets in an age of pure information products: An analysis of Online music and Online news,,2002,JOURNAL OF MANAGEMENT INFORMATION SYSTEMS,1,0.2875816993464052,44,18
1115,A model of neutral B2B,,2002,JOURNAL OF MANAGEMENT INFORMATION SYSTEMS,8,0.5842105263157895,111,20
1116,Market segmentation and information development costs in a two-tiered fee-based and sponsorship-based web site,,2002,JOURNAL OF MANAGEMENT INFORMATION SYSTEMS,1,0.18681318681318682,17,14
1117,Management of valuation of advertisement-supported web sites,,2002,JOURNAL OF MANAGEMENT INFORMATION SYSTEMS,14,0.6966666666666667,209,25
1118,Evolution of prices in electronic markets under diffusion of price-comparison shopping,,2002,JOURNAL OF MANAGEMENT INFORMATION SYSTEMS,8,0.4064516129032258,189,31
1119,A query-driven approach to the design and management of flexible database systems,,2002,JOURNAL OF MANAGEMENT INFORMATION SYSTEMS,6,0.7316017316017316,169,22
1120,Effects of local versus global schema diagrams on verification and communication conceptual data modeling,,2002,JOURNAL OF MANAGEMENT INFORMATION SYSTEMS,16,0.3626373626373626,33,14
1121,Effects of group support systems and content facilitation on knowledge acquisition,,2002,JOURNAL OF MANAGEMENT INFORMATION SYSTEMS,15,0.8052631578947368,153,20
1122,"Turnover of information technology workers: Examining empirically the influence of attitudes, job characteristics, and external markets",,2002,JOURNAL OF MANAGEMENT INFORMATION SYSTEMS,10,0.8484848484848485,196,22
1123,Understanding network effects in software markets: Evidence from Web server pricing,,2002,MIS QUARTERLY,8,0.3128205128205128,244,40
1124,Technology frames and framing: A socio-cognitive investigation of requirements determination,,2002,MIS QUARTERLY,11,0.38461538461538464,35,14
1125,Cross-cultural software production and use: A structurational analysis,,2002,MIS QUARTERLY,14,0.6833333333333333,82,16
1126,An empirical examination of individual traits as antecedents to computer anxiety and computer self-efficacy,,2002,MIS QUARTERLY,19,0.5672514619883041,97,19
1127,Review: Power and information technology research: A metatriangulation review,,2002,MIS QUARTERLY,24,0.22698412698412698,143,36
1128,Toward new metrics for net-enhanced organizations,,2002,INFORMATION SYSTEMS RESEARCH,21,0.4700854700854701,165,27
1129,Businesses as buildings: Metrics for the architectural quality of Internet businesses,,2002,INFORMATION SYSTEMS RESEARCH,21,0.7894736842105263,135,19
1130,Measuring switching costs and the determinants of customer retention in Internet-enabled businesses: A study of the Online brokerage industry,,2002,INFORMATION SYSTEMS RESEARCH,3,0.34065934065934067,31,14
1131,e-Commerce metrics for net-enhanced organizations: Assessing the value of e-commerce to firm performance in the manufacturing sector,,2002,INFORMATION SYSTEMS RESEARCH,23,0.5583333333333333,67,16
1132,The measurement of web-customer satisfaction: An expectation and disconfirmation approach,,2002,INFORMATION SYSTEMS RESEARCH,21,0.64,208,26
1133,Antecedents of B2C channel satisfaction and preference: Validating e-commerce metrics,,2002,INFORMATION SYSTEMS RESEARCH,8,0.7647058823529411,104,17
1134,Developing and validating trust measures for e-commerce: An integrative typology,,2002,INFORMATION SYSTEMS RESEARCH,14,0.6317073170731707,518,41
1135,The shareholder-wealth and trading-volume effects of information-technology infrastructure investments,,2002,JOURNAL OF MANAGEMENT INFORMATION SYSTEMS,23,0.40350877192982454,69,19
1136,Managing information technology investment risk: A real options perspective,,2002,JOURNAL OF MANAGEMENT INFORMATION SYSTEMS,12,0.6083333333333333,73,16
1137,Information-technology investment decisions: When do costs and benefits in the social subsystem matter?,,2002,JOURNAL OF MANAGEMENT INFORMATION SYSTEMS,23,0.5220588235294118,71,17
1138,Research in information systems: An empirical study of diversity in the discipline and its journals,,2002,JOURNAL OF MANAGEMENT INFORMATION SYSTEMS,24,0.7105263157894737,135,20
1139,Development of a measure for the organizational learning construct,,2002,JOURNAL OF MANAGEMENT INFORMATION SYSTEMS,21,0.5507246376811594,152,24
1140,The role of similarity in the reuse of object-oriented analysis models,,2002,JOURNAL OF MANAGEMENT INFORMATION SYSTEMS,25,0.1,1,5
1141,A discrepancy model of information system personnel turnover,,2002,JOURNAL OF MANAGEMENT INFORMATION SYSTEMS,10,0.7391304347826086,204,24
1142,Job satisfaction of information technology workers: The impact of career orientation and task automation in a CASE environment,,2002,JOURNAL OF MANAGEMENT INFORMATION SYSTEMS,10,0.7107692307692308,231,26
1143,The dynamic effects of group support systems on group meetings,,2002,JOURNAL OF MANAGEMENT INFORMATION SYSTEMS,15,0.558974358974359,436,40
1144,A design theory for systems that support emergent knowledge processes,,2002,MIS QUARTERLY,16,0.1657754010695187,93,34
1145,Studying knowledge management in information systems research: Discourses and theoretical assumptions,,2002,MIS QUARTERLY,16,0.5932203389830508,1015,59
1146,Evidence of the effect of trust building technology in electronic markets: Price premiums and buyer behavior,,2002,MIS QUARTERLY,14,0.573549257759784,425,39
1147,Knowledge management in pursuit of performance: Insights from Nortel Networks,,2002,MIS QUARTERLY,16,1.0,36,9
1148,NEBIC: A dynamic capabilities theory for assessing net-enablement,,2002,INFORMATION SYSTEMS RESEARCH,26,0.4276923076923077,139,26
1149,The net-enabled business innovation cycle and the evolution of dynamic capabilities,,2002,INFORMATION SYSTEMS RESEARCH,23,0.3333333333333333,26,13
1150,"Web site usability, design, and performance metrics",,2002,INFORMATION SYSTEMS RESEARCH,14,0.6137931034482759,267,30
1151,Assessing a firm's Web presence: A heuristic evaluation procedure for the measurement of usability,,2002,INFORMATION SYSTEMS RESEARCH,14,0.6305418719211823,256,29
1152,Measuring factors that influence the success of Internet commerce,,2002,INFORMATION SYSTEMS RESEARCH,21,0.6878306878306878,260,28
1153,Applying the technology acceptance model and flow theory to online consumer behavior,,2002,INFORMATION SYSTEMS RESEARCH,14,0.2857142857142857,66,22
1154,Learning to implement enterprise systems: An exploratory study of the dialectics of change,,2002,JOURNAL OF MANAGEMENT INFORMATION SYSTEMS,10,0.5641025641025641,44,13
1155,Implementation team responsiveness and user evaluation of Customer Relationship Management: A quasi-experimental design study of social exchange theory,,2002,JOURNAL OF MANAGEMENT INFORMATION SYSTEMS,20,0.0,0,2
1156,Investment in Enterprise Resource Planning: Business impact and productivity measures,,2002,JOURNAL OF MANAGEMENT INFORMATION SYSTEMS,10,0.8589743589743589,67,13
