id,label,timeset,py,so,modularity_class,clustering,triangles,degree
504,"WHY BREAK THE HABIT OF A LIFETIME? RETHINKING THE ROLES OF INTENTION, HABIT, AND EMOTION IN CONTINUING INFORMATION TECHNOLOGY USE",,2009,MIS QUARTERLY,17,0.34285714285714286,36,15
505,MINIMIZING METHOD BIAS THROUGH PROGRAMMATIC RESEARCH,,2009,MIS QUARTERLY,24,0.3523809523809524,37,15
506,ESTIMATING THE EFFECT OF COMMON METHOD VARIANCE: THE METHOD-METHOD PAIR TECHNIQUE WITH AN ILLUSTRATION FROM TAM RESEARCH,,2009,MIS QUARTERLY,21,0.26666666666666666,32,16
507,WEB STRATEGIES TO PROMOTE INTERNET SHOPPING: IS CULTURAL-CUSTOMIZATION NEEDED?,,2009,MIS QUARTERLY,14,0.3333333333333333,70,21
508,THE INTEGRATIVE FRAMEWORK OF TECHNOLOGY USE: AN EXTENSION AND TEST,,2009,MIS QUARTERLY,17,0.16666666666666666,6,9
509,EXPLORING HUMAN IMAGES IN WEBSITE DESIGN: A MULTI-METHOD APPROACH,,2009,MIS QUARTERLY,1,0.49783549783549785,115,22
510,INVESTIGATING USER RESISTANCE TO INFORMATION SYSTEMS IMPLEMENTATION: A STATUS QUO BIAS PERSPECTIVE,,2009,MIS QUARTERLY,24,0.41818181818181815,23,11
511,DIVIDED BY A COMMON LANGUAGE? A RESPONSE TO MARSHALL SCOTT POOLE,,2009,MIS QUARTERLY,24,0.4725274725274725,43,14
512,"THE EVOLUTION OF RISK IN INFORMATION SYSTEMS OFFSHORING: THE IMPACT OF HOME COUNTRY RISK, FIRM LEARNING, AND COMPETITIVE DYNAMICS",,2009,MIS QUARTERLY,11,0.6794871794871795,53,13
513,OFFSHORE INFORMATION SYSTEMS PROJECT SUCCESS: THE ROLE OF SOCIAL EMBEDDEDNESS AND CULTURAL CHARACTERISTICS,,2009,MIS QUARTERLY,11,0.5349206349206349,337,36
514,Antecedents of IS Strategic Alignment: A Nomological Network,,2009,INFORMATION SYSTEMS RESEARCH,7,0.5631578947368421,107,20
515,Governance-Knowledge Fit in Systems Development Projects,,2009,INFORMATION SYSTEMS RESEARCH,11,0.5226890756302521,311,35
516,Configuration of and Interaction Between Information Security Technologies: The Case of Firewalls and Intrusion Detection Systems,,2009,INFORMATION SYSTEMS RESEARCH,12,0.7549407114624506,191,23
517,Willingness to Pay in an Open Source Software Environment,,2009,INFORMATION SYSTEMS RESEARCH,13,0.4782608695652174,121,23
518,"Trust and Satisfaction, Two Stepping Stones for Successful E-Commerce Relationships: A Longitudinal Exploration",,2009,INFORMATION SYSTEMS RESEARCH,14,0.6693657219973009,496,39
519,Demand Heterogeneity in IT Infrastructure Services: Modeling and Evaluation of a Dynamic Approach to Defining Service Levels,,2009,INFORMATION SYSTEMS RESEARCH,20,0.3475783475783476,122,27
520,"Social Interactions and the ""Digital Divide"": Explaining Variations in Internet Use",,2009,INFORMATION SYSTEMS RESEARCH,26,0.13333333333333333,2,6
521,From Association to Causation via a Potential Outcomes Approach,,2009,INFORMATION SYSTEMS RESEARCH,21,0.48615384615384616,158,26
522,A Meta-Theory for Understanding Information Systems Within Sociotechnical Systems,,2009,JOURNAL OF MANAGEMENT INFORMATION SYSTEMS,24,0.21921182266009853,89,29
523,Decentralization in Wikipedia Governance,,2009,JOURNAL OF MANAGEMENT INFORMATION SYSTEMS,22,0.75,102,17
524,Engaging Group E-Learning in Virtual Worlds,,2009,JOURNAL OF MANAGEMENT INFORMATION SYSTEMS,4,0.5473684210526316,104,20
525,Chaos Theory as a Lens for Interpreting Blogging,,2009,JOURNAL OF MANAGEMENT INFORMATION SYSTEMS,17,0.2777777777777778,10,9
526,Managing Knowledge in Light of Its Evolution Process: An Empirical Study on Citation Network-Based Patent Classification,,2009,JOURNAL OF MANAGEMENT INFORMATION SYSTEMS,16,0.5776942355889725,922,57
527,The CMC Interactivity Model: How Interactivity Enhances Communication Quality and Process Satisfaction in Lean-Media Groups,,2009,JOURNAL OF MANAGEMENT INFORMATION SYSTEMS,15,0.4898785425101215,363,39
528,Leveraging Crowdsourcing: Activation-Supporting Components for IT-Based Ideas Competition,,2009,JOURNAL OF MANAGEMENT INFORMATION SYSTEMS,15,0.6222222222222222,28,10
529,A Design Approach for Collaboration Processes: A Multimethod Design Science Study in Collaboration Engineering,,2009,JOURNAL OF MANAGEMENT INFORMATION SYSTEMS,4,0.3904761904761905,82,21
530,Organizational Assimilation of Electronic Procurement Innovations,,2009,JOURNAL OF MANAGEMENT INFORMATION SYSTEMS,7,0.9047619047619048,19,7
531,Differential Effects of the Two Types of Information Systems: A Hospital-Based Study,,2009,JOURNAL OF MANAGEMENT INFORMATION SYSTEMS,0,0.32857142857142857,69,21
532,WHOM ARE WE INFORMING? ISSUES AND RECOMMENDATIONS FOR MIS RESEARCH FROM AN INFORMING SCIENCES PERSPECTIVE,,2009,MIS QUARTERLY,24,0.8095238095238095,85,15
533,A SCIENTIFIC BASIS FOR RIGOR IN INFORMATION SYSTEMS RESEARCH,,2009,MIS QUARTERLY,24,0.36764705882352944,50,17
534,INTERNET EXCHANGES FOR USED GOODS: AN EMPIRICAL ANALYSIS OF TRADE PATTERNS AND ADVERSE SELECTION,,2009,MIS QUARTERLY,8,0.4637096774193548,230,32
535,INTERACTIVE DECISION AIDS FOR CONSUMER DECISION MAKING IN E-COMMERCE: THE INFLUENCE OF PERCEIVED STRATEGY RESTRICTIVENESS,,2009,MIS QUARTERLY,18,0.6909090909090909,38,11
536,COMPETING WITH FREE: THE IMPACT OF MOVIE BROADCASTS ON DVD SALES AND INTERNET PIRACY,,2009,MIS QUARTERLY,13,0.3619047619047619,38,15
537,ADOPTION OF ELECTRONIC HEALTH RECORDS IN THE PRESENCE OF PRIVACY CONCERNS: THE ELABORATION LIKELIHOOD MODEL AND INDIVIDUAL PERSUASION,,2009,MIS QUARTERLY,5,0.7122507122507122,250,27
538,MODEL OF ACCEPTANCE WITH PEER SUPPORT: A SOCIAL NETWORK PERSPECTIVE TO UNDERSTAND EMPLOYEES' SYSTEM USE,,2009,MIS QUARTERLY,0,0.3402439024390244,279,41
539,INFORMATION SYSTEMS THEORIZING BASED ON EVOLUTIONARY PSYCHOLOGY: AN INTERDISCIPLINARY REVIEW AND THEORY INTEGRATION FRAMEWORK,,2009,MIS QUARTERLY,24,0.4,4,5
540,A META-ANALYSIS OF THE ROLE OF ENVIRONMENT-BASED VOLUNTARINESS IN INFORMATION TECHNOLOGY ACCEPTANCE,,2009,MIS QUARTERLY,17,0.553030303030303,292,33
541,Does Fit Matter? The Impact of Task-Technology Fit and Appropriation on Team Performance in Repeated Tasks,,2009,INFORMATION SYSTEMS RESEARCH,4,0.8266129032258065,410,32
542,Information Technology in Supply Chains: The Value of IT-Enabled Resources Under Competition,,2009,INFORMATION SYSTEMS RESEARCH,23,0.6373626373626373,58,14
543,A Computational Analysis of Linear Price Iterative Combinatorial Auction Formats,,2009,INFORMATION SYSTEMS RESEARCH,2,0.8319088319088319,292,27
544,The Influence of Website Characteristics on a Consumer's Urge to Buy Impulsively,,2009,INFORMATION SYSTEMS RESEARCH,1,0.45584045584045585,160,27
545,User Awareness of Security Countermeasures and Its Impact on Information Systems Misuse: A Deterrence Approach,,2009,INFORMATION SYSTEMS RESEARCH,12,0.705050505050505,698,45
546,Impact of the Union and Difference Operations on the Quality of Information Products,,2009,INFORMATION SYSTEMS RESEARCH,25,0.5277777777777778,19,9
547,Choice and Chance: A Conceptual Model of Paths to Information Security Compromise,,2009,INFORMATION SYSTEMS RESEARCH,12,0.6984273820536541,755,47
548,Investments in Information Technology: Indirect Effects and Information Technology Intensity,,2009,INFORMATION SYSTEMS RESEARCH,1,0.3203463203463203,74,22
549,Understanding Sustained Participation in Open Source Software Projects,,2009,JOURNAL OF MANAGEMENT INFORMATION SYSTEMS,25,0.5095238095238095,107,21
550,Competence of IT Professionals in E-Business Venture Teams: The Effect of Experience and Expertise on Preference Structure,,2009,JOURNAL OF MANAGEMENT INFORMATION SYSTEMS,4,0.8709677419354839,405,31
551,How Knowledge Validation Processes Affect Knowledge Contribution,,2009,JOURNAL OF MANAGEMENT INFORMATION SYSTEMS,16,0.7363945578231292,866,49
552,Preserving User Preferences in Automated Document-Category Management: An Evolution-Based Approach,,2009,JOURNAL OF MANAGEMENT INFORMATION SYSTEMS,6,0.7582417582417582,69,14
553,Evaluating Anthropomorphic Product Recommendation Agents: A Social Relationship Perspective to Designing Information Systems,,2009,JOURNAL OF MANAGEMENT INFORMATION SYSTEMS,1,0.07272727272727272,4,11
554,Managerial Entrenchment with Strategic Information Technology: A Dynamic Perspective,,2009,JOURNAL OF MANAGEMENT INFORMATION SYSTEMS,22,0.8571428571428571,180,21
555,Diversification and Firm Performance: Exploring the Moderating Effects of Information Technology Spending,,2009,JOURNAL OF MANAGEMENT INFORMATION SYSTEMS,23,0.5083333333333333,61,16
556,Optimal Digital Content Distribution Strategy in the Presence of the Consumer-to-Consumer Channel,,2009,JOURNAL OF MANAGEMENT INFORMATION SYSTEMS,8,0.5714285714285714,120,21
557,Patterns of Transition: The Shift from Traditional to Object-Oriented Development,,2009,JOURNAL OF MANAGEMENT INFORMATION SYSTEMS,25,0.2857142857142857,8,8
558,"THE SHOEMAKER'S CHILDREN: USING WIKIS FOR INFORMATION SYSTEMS TEACHING, RESEARCH, AND PUBLICATION",,2009,MIS QUARTERLY,14,0.5324675324675324,123,22
559,INFORMATIONAL CASCADES AND SOFTWARE ADOPTION ON THE INTERNET: AN EMPIRICAL INVESTIGATION,,2009,MIS QUARTERLY,0,0.5,14,8
560,OUT OF DEDICATION OR CONSTRAINT? A DUAL MODEL OF POST-ADOPTION PHENOMENA AND ITS EMPIRICAL TEST IN THE CONTEXT OF ONLINE SERVICES,,2009,MIS QUARTERLY,17,0.2833333333333333,34,16
561,AVOIDANCE OF INFORMATION TECHNOLOGY THREATS: A THEORETICAL PERSPECTIVE,,2009,MIS QUARTERLY,12,0.2683982683982684,62,22
562,ARE TWO HEADS BETTER THAN ONE FOR SOFTWARE DEVELOPMENT? THE PRODUCTIVITY PARADOX OF PAIR PROGRAMMING,,2009,MIS QUARTERLY,4,0.3333333333333333,5,6
563,THE ROLE OF SERVICE LEVEL AGREEMENTS IN RELATIONAL MANAGEMENT OF INFORMATION TECHNOLOGY OUTSOURCING: AN EMPIRICAL STUDY,,2009,MIS QUARTERLY,22,0.5714285714285714,132,22
564,POWER AND CONCESSION IN COMPUTER-MEDIATED NEGOTIATIONS: AN EXAMINATION OF FIRST OFFERS,,2009,MIS QUARTERLY,9,1.0,28,8
565,USING PLS PATH MODELING FOR ASSESSING HIERARCHICAL CONSTRUCT MODELS: GUIDELINES AND EMPIRICAL ILLUSTRATION,,2009,MIS QUARTERLY,21,0.8366013071895425,128,18
566,ASSESSING BETWEEN-GROUP DIFFERENCES IN INFORMATION SYSTEMS RESEARCH: A COMPARISON OF COVARIANCE- AND COMPONENT-BASED SEM,,2009,MIS QUARTERLY,21,0.5190476190476191,109,21
567,Consumer Surplus in Online Auctions,,2008,INFORMATION SYSTEMS RESEARCH,2,0.9891304347826086,273,24
568,The Consequences of Technostress for End Users in Organizations: Conceptual Development and Empirical Validation,,2008,INFORMATION SYSTEMS RESEARCH,0,0.5714285714285714,12,7
569,"A Model of Conflict, Leadership, and Performance in Virtual Teams",,2008,INFORMATION SYSTEMS RESEARCH,4,0.7914438502673797,444,34
570,Self-Selection and Information Role of Online Product Reviews,,2008,INFORMATION SYSTEMS RESEARCH,1,0.3764705882352941,224,35
571,From Peer Production to Productization: A Study of Socially Enabled Business Exchanges in Open Source Service Networks,,2008,INFORMATION SYSTEMS RESEARCH,25,0.9166666666666666,110,16
572,The Role of Feedback in Managing the Internet-Based Volunteer Work Force,,2008,INFORMATION SYSTEMS RESEARCH,15,0.16666666666666666,1,4
573,The Complementary Effects of E-Markets on Existing Supplier-Buyer Relationships in a Supply Chain,,2008,JOURNAL OF MANAGEMENT INFORMATION SYSTEMS,8,0.7714285714285715,81,15
574,Auctioning Vertically Integrated Online Services: Computational Approaches for Real-Time Allocation,,2008,JOURNAL OF MANAGEMENT INFORMATION SYSTEMS,20,0.33414634146341465,274,41
575,Trust and Electronic Government Success: An Empirical Study,,2008,JOURNAL OF MANAGEMENT INFORMATION SYSTEMS,14,0.605072463768116,167,24
576,Change Management in Interorganizational Systems for the Public,,2008,JOURNAL OF MANAGEMENT INFORMATION SYSTEMS,24,0.34065934065934067,31,14
577,Individual Adaptation to IT-Induced Change: The Role of Social Networks,,2008,JOURNAL OF MANAGEMENT INFORMATION SYSTEMS,0,0.36923076923076925,120,26
578,Determinants of the Choice of Open Source Software License,,2008,JOURNAL OF MANAGEMENT INFORMATION SYSTEMS,25,0.6796536796536796,157,22
579,The Impact of Open Source Software on the Strategic Choices of Firms Developing Proprietary Software,,2008,JOURNAL OF MANAGEMENT INFORMATION SYSTEMS,25,0.7157894736842105,136,20
580,Impact of Knowledge Support on the Performance of Software Process Tailoring,,2008,JOURNAL OF MANAGEMENT INFORMATION SYSTEMS,25,0.3076923076923077,28,14
581,Tuning Data Mining Methods for Cost-Sensitive Regression: A Study in Loan Charge-Off Forecasting,,2008,JOURNAL OF MANAGEMENT INFORMATION SYSTEMS,3,0.4230769230769231,33,13
582,Investments in Information Security: A Real Options Perspective with Bayesian Postaudit,,2008,JOURNAL OF MANAGEMENT INFORMATION SYSTEMS,12,0.5626262626262626,557,45
583,MARSHALING THE PROFESSIONAL EXPERIENCE OF DOCTORAL STUDENTS: A CONTRIBUTION TO THE PRACTICAL RELEVANCE DEBATE,,2008,MIS QUARTERLY,16,0.37192118226600984,151,29
584,A FAST FORM APPROACH TO MEASURING TECHNOLOGY ACCEPTANCE AND OTHER CONSTRUCTS,,2008,MIS QUARTERLY,21,0.45803698435277385,322,38
585,"BUYER INTENTION TO USE INTERNET-ENABLED REVERSE AUCTIONS: THE ROLE OF ASSET SPECIFICITY, PRODUCT SPECIALIZATION, AND NON-CONTRACTIBILITY",,2008,MIS QUARTERLY,8,0.6257309941520468,107,19
586,THE DESIGN THEORY NEXUS,,2008,MIS QUARTERLY,24,0.30158730158730157,114,28
587,PROCESS GRAMMAR AS A TOOL FOR BUSINESS PROCESS DESIGN,,2008,MIS QUARTERLY,24,0.2633333333333333,79,25
588,MAKING SENSE OF TECHNOLOGY TRENDS IN THE INFORMATION TECHNOLOGY LANDSCAPE: A DESIGN SCIENCE APPROACH,,2008,MIS QUARTERLY,23,0.4166666666666667,15,9
589,CYBERGATE: A DESIGN FRAMEWORK AND SYSTEM FOR TEXT ANALYSIS OF COMPUTER-MEDIATED COMMUNICATION,,2008,MIS QUARTERLY,24,0.2,2,5
590,USING COGNITIVE PRINCIPLES To GUIDE CLASSIFICATION IN INFORMATION SYSTEMS MODELING,,2008,MIS QUARTERLY,24,0.19367588932806323,49,23
591,Casting the net: A multimodal network perspective on user-system interactions,,2008,INFORMATION SYSTEMS RESEARCH,0,0.3492063492063492,132,28
592,The effects of the social structure of digital networks on viral marketing performance,,2008,INFORMATION SYSTEMS RESEARCH,0,0.31414141414141417,311,45
593,Examining the relationship between reviews and sales: The role of reviewer identity disclosure in electronic markets,,2008,INFORMATION SYSTEMS RESEARCH,1,0.7428571428571429,156,21
594,Social capital and knowledge integration in digitally enabled teams,,2008,INFORMATION SYSTEMS RESEARCH,4,0.803921568627451,451,34
595,Towards dynamic visualization for understanding evolution of digital communication networks,,2008,INFORMATION SYSTEMS RESEARCH,0,0.4230769230769231,330,40
596,The impact of information diffusion on bidding behavior in secret reserve price auctions,,2008,INFORMATION SYSTEMS RESEARCH,2,0.8676923076923077,282,26
597,Emergence of new project teams from open source software developer networks: Impact of prior collaboration ties,,2008,INFORMATION SYSTEMS RESEARCH,4,0.42492492492492495,283,37
598,How information changes consumer behavior and how consumer behavior determines corporate strategy,,2008,JOURNAL OF MANAGEMENT INFORMATION SYSTEMS,8,0.2920634920634921,184,36
599,How does information technology shape supply-chain structure? Evidence on the number of suppliers,,2008,JOURNAL OF MANAGEMENT INFORMATION SYSTEMS,8,0.5906432748538012,101,19
600,How has electronic travel distribution been transformed? A test of the theory of newly vulnerable markets,,2008,JOURNAL OF MANAGEMENT INFORMATION SYSTEMS,8,0.6078431372549019,93,18
601,Information risk of inadvertent disclosure: An analysis of file-sharing risk in the financial supply chain,,2008,JOURNAL OF MANAGEMENT INFORMATION SYSTEMS,12,0.6799431009957326,478,38
602,The deterrent and displacement effects of information security enforcement: International evidence,,2008,JOURNAL OF MANAGEMENT INFORMATION SYSTEMS,12,0.8888888888888888,32,9
603,Does competition promote trust and trustworthiness in online trading? An experimental study,,2008,JOURNAL OF MANAGEMENT INFORMATION SYSTEMS,8,0.4894179894179894,185,28
604,Design and ownership of two-sided networks: Implications for Internet platforms,,2008,JOURNAL OF MANAGEMENT INFORMATION SYSTEMS,0,0.5287356321839081,230,30
605,Uncertainty and industry structure effects on managerial intuition about information technology real options,,2008,JOURNAL OF MANAGEMENT INFORMATION SYSTEMS,12,0.8636363636363636,57,12
606,Understanding the value of countermeasure portfolios in information systems security,,2008,JOURNAL OF MANAGEMENT INFORMATION SYSTEMS,12,0.6763285024154589,700,46
607,Decision-theoretic and game-theoretic approaches to IT security investment,,2008,JOURNAL OF MANAGEMENT INFORMATION SYSTEMS,12,0.5885057471264368,256,30
608,Uncovering the intellectual core of the information systems discipline,,2008,MIS QUARTERLY,24,0.36693548387096775,182,32
609,"Predicting different conceptualizations of system use: The competing roles of behavioral intention, facilitating conditions, and behavioral expectation",,2008,MIS QUARTERLY,17,0.35,42,16
610,Internet users' information privacy-protective responses: A taxonomy and a nomological model,,2008,MIS QUARTERLY,5,0.7907692307692308,257,26
611,Business familiarity as risk mitigation in software development outsourcing contracts,,2008,MIS QUARTERLY,22,0.8830409356725146,151,19
612,Representing part-whole relations in conceptual modeling: An empirical evaluation,,2008,MIS QUARTERLY,16,0.48717948717948717,38,13
613,"Media, tasks, and communication processes: A theory of media synchronicity",,2008,MIS QUARTERLY,15,0.7076923076923077,230,26
614,"A three-perspective model of culture, information systems, and their development and use",,2008,MIS QUARTERLY,14,0.5631578947368421,107,20
615,Emotional dissonance and the information technology professional,,2008,MIS QUARTERLY,10,0.5147058823529411,70,17
616,Dressing your online auction business for success: An experiment comparing two eBay businesses,,2008,MIS QUARTERLY,2,0.8676923076923077,282,26
617,Predictors of formal control usage in IT outsourcing partnerships,,2008,INFORMATION SYSTEMS RESEARCH,11,0.47058823529411764,72,18
618,Capacity provision networks: Foundations of markets for sharable resources in distributed computational economies,,2008,INFORMATION SYSTEMS RESEARCH,20,0.3333333333333333,155,31
619,Addressing the what and how of online services: Positioning supporting-services functionality and service quality for business-to-consumer success,,2008,INFORMATION SYSTEMS RESEARCH,20,0.3377630121816168,305,43
620,Marketspace or marketplace? Online information search and channel outcomes in auto retailing,,2008,INFORMATION SYSTEMS RESEARCH,2,0.38095238095238093,80,21
621,On vendor preferences for contract types in offshore software projects: The case of fixed price vs. time and materials contracts,,2008,INFORMATION SYSTEMS RESEARCH,22,0.5527065527065527,194,27
622,Awareness displays and social motivation for coordinating communication,,2008,INFORMATION SYSTEMS RESEARCH,4,0.25735294117647056,35,17
623,Risk Management of Contract Portfolios in IT Services: The Profit-at-Risk Approach,,2008,JOURNAL OF MANAGEMENT INFORMATION SYSTEMS,22,0.5766666666666667,173,25
624,Stylometric Identification in Electronic Markets: Scalability and Robustness,,2008,JOURNAL OF MANAGEMENT INFORMATION SYSTEMS,8,0.7424242424242424,49,12
625,Mining Trading Partners' Preferences for Efficient Multi-Issue Bargaining in E-Business,,2008,JOURNAL OF MANAGEMENT INFORMATION SYSTEMS,9,1.0,28,8
626,"Multiple Group Coordination in Complex and Dynamic Task Environments: Interruptions, Coping Mechanisms, and Technology Recommendations",,2008,JOURNAL OF MANAGEMENT INFORMATION SYSTEMS,4,0.43333333333333335,52,16
627,Factors in the Global Assimilation of Collaborative Information Technologies: An Exploratory Investigation in Five Regions,,2008,JOURNAL OF MANAGEMENT INFORMATION SYSTEMS,7,0.6666666666666666,24,9
628,Manufacturers' Distribution Strategy in the Presence of the Electronic Channel,,2008,JOURNAL OF MANAGEMENT INFORMATION SYSTEMS,8,0.6105263157894737,116,20
629,An Economic Analysis of Policies for the Protection and Reuse of Noncopyrightable Database Contents,,2008,JOURNAL OF MANAGEMENT INFORMATION SYSTEMS,6,0.8210526315789474,156,20
630,Effect of Network Relations on the Adoption of Electronic Trading Systems,,2008,JOURNAL OF MANAGEMENT INFORMATION SYSTEMS,8,0.5187165775401069,291,34
631,How Endogenous Motivations Influence User Intentions: Beyond the Dichotomy of Extrinsic and Intrinsic User Motivations,,2008,JOURNAL OF MANAGEMENT INFORMATION SYSTEMS,17,0.2709447415329768,152,34
632,The Role of User Participation in Information Systems Development: Implications from a Meta-Analysis,,2008,JOURNAL OF MANAGEMENT INFORMATION SYSTEMS,17,0.3333333333333333,12,9
633,"Cocreating understanding and value in distributed work: How members of onsite and offshore vendor teams give, make, demand, and break sense",,2008,MIS QUARTERLY,11,0.37777777777777777,17,10
634,Two-stage offshoring: An investigation of the Irish bridge,,2008,MIS QUARTERLY,11,0.5619047619047619,59,15
635,Managing the knowledge supply chain: An organizational learning model of information technology offshore outsourcing,,2008,MIS QUARTERLY,11,0.7424242424242424,49,12
636,Innovating or doing as told? Status differences and overlapping boundaries in offshore collaboration,,2008,MIS QUARTERLY,4,0.375,45,16
637,Explaining variations in client extra costs between software projects offshored to India,,2008,MIS QUARTERLY,11,0.4327485380116959,74,19
638,Is the world really flat? A look at offshoring at an online programming marketplace,,2008,MIS QUARTERLY,11,0.44871794871794873,35,13
639,Outsourcing to an unknown workforce: Exploring opensourcing as a global sourcing strategy,,2008,MIS QUARTERLY,25,0.6783625730994152,116,19
640,Transformational technologies and the creation of new work practices: Making implicit knowledge explicit in task-based offshoring,,2008,MIS QUARTERLY,11,0.5454545454545454,30,11
641,"Work dispersion, process-based learning, and offshore software development performance",,2008,MIS QUARTERLY,11,0.5824175824175825,53,14
642,CONQUER: A methodology for context-aware query processing on the World Wide Web,,2008,INFORMATION SYSTEMS RESEARCH,6,0.4,22,11
643,Using self-regulatory learning to enhance e-learning-based information technology training,,2008,INFORMATION SYSTEMS RESEARCH,19,0.5652173913043478,156,24
644,Let the pirates patch? An economic analysis of software security patch restrictions,,2008,INFORMATION SYSTEMS RESEARCH,13,0.383399209486166,97,23
645,A comparison of pair versus solo programming under different objectives: An analytical approach,,2008,INFORMATION SYSTEMS RESEARCH,4,0.17857142857142858,5,8
646,How does personality matter? Relating the five-factor model to technology acceptance and use,,2008,INFORMATION SYSTEMS RESEARCH,17,0.35333333333333333,106,25
647,A value-at-risk approach to information security investment,,2008,INFORMATION SYSTEMS RESEARCH,12,0.6134751773049646,692,48
648,Self-perception-based versus transference-based trust determinants in computer-mediated transactions: A cross-cultural comparison study,,2008,JOURNAL OF MANAGEMENT INFORMATION SYSTEMS,14,0.46825396825396826,177,28
649,"Modeling web site design across cultures: Relationships to trust, satisfaction, and e-loyalty",,2008,JOURNAL OF MANAGEMENT INFORMATION SYSTEMS,14,0.5367647058823529,73,17
650,Examining trust in information technology artifacts: The effects of system quality and culture,,2008,JOURNAL OF MANAGEMENT INFORMATION SYSTEMS,14,0.7174603174603175,452,36
651,Establishing trust in electronic commerce through online word of mouth: An examination across genders,,2008,JOURNAL OF MANAGEMENT INFORMATION SYSTEMS,14,0.6229885057471264,271,30
652,In justice we trust: Predicting user acceptance of e-customer services,,2008,JOURNAL OF MANAGEMENT INFORMATION SYSTEMS,14,0.6907563025210084,411,35
653,"Gaining trust through online privacy protection: Self-regulation, mandatory standards, or Caveat Emptor",,2008,JOURNAL OF MANAGEMENT INFORMATION SYSTEMS,14,0.7344028520499108,412,34
654,Online reverse auctions and the dynamics of trust,,2008,JOURNAL OF MANAGEMENT INFORMATION SYSTEMS,8,0.6410256410256411,50,13
655,Explaining and predicting the impact of branding alliances and web site quality on initial consumer trust of e-commerce web sites,,2008,JOURNAL OF MANAGEMENT INFORMATION SYSTEMS,14,0.496551724137931,216,30
656,Dynamics of trust revision: Using health infomediaries,,2008,JOURNAL OF MANAGEMENT INFORMATION SYSTEMS,14,0.6202090592334495,534,42
657,Attributions of trust in decision support technologies: A study of recommendation agents for e-commerce,,2008,JOURNAL OF MANAGEMENT INFORMATION SYSTEMS,14,0.6705128205128205,523,40
658,A research agenda for trust in online environments,,2008,JOURNAL OF MANAGEMENT INFORMATION SYSTEMS,14,0.6705128205128205,523,40
659,Toward improving the relevance of information systems research to practice: The role of applicability checks,,2008,MIS QUARTERLY,24,0.24777183600713013,139,34
660,Contribution behaviors in distributed environments,,2008,MIS QUARTERLY,17,0.26666666666666666,12,10
661,Extending the understanding of end user information systems satisfaction formation: An equitable needs fulfillment model approach,,2008,MIS QUARTERLY,17,0.308300395256917,78,23
662,"Information technology governance in information technology investment decision processes: The impact of investment characteristics, external environment, and internal context",,2008,MIS QUARTERLY,22,0.5612648221343873,142,23
663,Understanding digital inequality: Comparing continued use behavioral models of the socio-economically advantaged and disadvantaged,,2008,MIS QUARTERLY,26,0.4,4,5
664,Giddens's structuration theory and information systems research,,2008,MIS QUARTERLY,24,0.30666666666666664,92,25
665,Using an attribute-based decision support system for user-customized products online: An experimental investigation,,2008,MIS QUARTERLY,18,0.7878787878787878,52,12
666,The relative advantage of electronic channels: A multidimensional view,,2008,MIS QUARTERLY,8,0.7426470588235294,101,17
